投诉编号,投诉品牌,投诉车系,问题简述,典型问题,投诉时间,投诉状态
477907,广汽丰田,2016款 1.6G CVT 精英版,广汽丰田雷凌发动机故障灯报警,发动机故障灯亮,2020-06-21 09:49:56.028,处理反馈
477906,吉利汽车,2019款 350T 耀星者,吉利星越车机与宣传不符 发动机无机油尺,销售欺诈与宣传不符其他疑似设计缺陷,2020-06-21 09:49:56.040,处理反馈
477904,一汽-大众,2018款 230TSI 自动 舒适型,一汽大众高尔夫挂挡异响并产生共振,变速器异响变速器共振,2020-06-21 09:49:56.052,用户评分
477903,长城汽车,2016款 1.5T 手动 两驱 精英型 升级版,哈弗H6经销商强制购买保险捆绑销售,服务收费强制购买,2020-06-21 09:49:56.062,处理反馈
477902,东风日产,2019款 2.0L XL 舒适版,东风日产天籁减震器与油箱异响希望处理,前后桥及悬挂系统减震器异响车身附件及电器汽油箱异响,2020-06-21 09:49:56.073,处理反馈
477901,上汽大众,2019款 230TSI DSG 风尚版 国V,上汽大众凌渡行驶加速变速箱异响,发动机异响变速器异响,2020-06-21 09:49:56.887,处理反馈
477899,一汽-大众,2019款 280TSI DSG 舒适型 国VI,一汽大众速腾宣传坡路起车辅助系统实际未有,车身附件及电器行车安全辅助系统故障销售欺诈与宣传不符,2020-06-21 09:49:56.900,处理反馈
477897,一汽解放,轻卡,一汽解放虎V后桥异响齿轮磨损严重希望处理,前后桥及悬挂系统前后桥异响,2020-06-21 09:49:56.910,信息审核
477894,一汽-大众,2019款 280TSI DSG 舒适型 国VI,一汽大众速腾坡道辅助系统缺失涉嫌欺诈销售,车身附件及电器行车安全辅助系统故障销售欺诈与宣传不符,2020-06-21 09:49:56.927,用户评分
477890,东风标致,2013款 1.6T 自动 THP至尚版,东风标致3008碳罐设计不合理导致油表不准,车身附件及电器油箱有缺陷,2020-06-21 09:49:56.939,处理反馈
477889,上汽集团,2019款 20T 自动 两驱 Trophy超跑版 国VI,上汽名爵HS变速箱异响 发动机故障灯亮,发动机故障灯亮变速器异响,2020-06-21 09:49:56.948,处理反馈
477888,上汽斯柯达,2017款 1.6L 自动 智行版,斯柯达明锐中网严重掉漆脱皮影响美观,车身附件及电器车身装饰脱落,2020-06-21 09:49:56.957,用户评分
477887,上汽大众,2015款 1.6L 手动 风尚版,上汽大众朗逸车门限位器钣金严重生锈,车身附件及电器车身生锈,2020-06-21 09:49:56.966,处理反馈
477885,众泰汽车,2015款 标准型,众泰江南T11动力电池故障希望厂家处理,车身附件及电器动力电池故障,2020-06-21 09:49:56.980,信息审核
477880,一汽-大众,2019款 280TSI DSG 舒适型 国VI,一汽大众速腾上坡辅助系统与宣传不符,销售欺诈与宣传不符,2020-06-21 09:49:56.990,用户评分
477876,上汽通用雪佛兰,2016款 2.0L 豪华版,雪佛兰迈锐宝挂入P挡后仪表上显示未挂入,变速器挡把总成故障,2020-06-21 09:49:56.998,处理反馈
477874,东风日产,2016款 2.0L CVT 豪华版,东风日产逍客变速箱故障抖动无法加速,变速器抖动变速器无法加速变速器滑阀箱故障,2020-06-21 09:49:57.007,处理反馈
477873,广汽丰田,2018款 2.5HG E-CVT 豪华版,广汽丰田凯美瑞机油增多伴有汽油味,发动机机油增多,2020-06-21 09:49:57.017,用户评分
477871,一汽-大众,2019款 280TSI DSG 舒适型 国VI,一汽大众速腾上坡辅助系统与宣传不符,销售欺诈与宣传不符,2020-06-21 09:49:57.027,用户评分
477870,一汽马自达,2020款 2.5L 蓝天运动版,一汽马自达阿特兹车身异响 B柱异响,车身附件及电器车内异响车身附件及电器中控台异响,2020-06-21 09:49:57.038,用户评分
477867,广汽三菱,2019款 1.5T CVT 两驱 梦想版 国VI,广汽三菱奕歌发动机异响 经销商无配件,发动机异响配件争议无零配件,2020-06-21 09:49:57.047,用户评分
477863,长安福特,2018款 EcoBoost 180 自动 运动型 两厢经典,长安福特福克斯发动机启停功能无法使用,车身附件及电器发动机启停系统故障,2020-06-21 09:49:57.056,用户评分
477862,一汽-大众,2018款 1.6L 自动 舒适型,一汽大众速腾经销商出售问题车厂家不处理,服务态度不解决问题销售欺诈出售问题车,2020-06-21 09:49:57.065,用户评分
477861,北京现代,2017款 1.8L 自动 尊贵型 DLX 国V,北京现代名图变速箱卡顿希望厂家拒绝处理,变速器顿挫,2020-06-21 09:49:57.076,用户评分
477860,东风日产,2016款 1.6L CVT 智行版,东风日产骐达加油时无法提速厂家不予质保,变速器异响变速器无法加速服务态度不予索赔,2020-06-21 09:49:57.086,用户评分
477859,奇瑞汽车,2018款 1.5T CVT 型色版 国V,奇瑞艾瑞泽GX变速箱顿挫 车身异响,发动机油耗高变速器顿挫车身附件及电器门窗异响车身附件及电器车内异响车身附件及电器车身异响,2020-06-21 09:49:57.096,处理反馈
477857,上汽大众,2016款 1.6L 手动 风尚版 三厢,上汽大众桑塔纳韩泰轮胎全部出现裂纹,轮胎开裂,2020-06-21 09:49:57.105,用户评分
477856,一汽吉林,2017款 1.6L 自动 智享型 智能网联版,一汽吉林森雅R7发动机缺缸存在质量问题,发动机功率不足,2020-06-21 09:49:57.114,信息审核
477855,江铃汽车,2017款 2.8T 商运型 短轴 中顶 6/7/8座 JX493,江铃特顺发动机故障灯亮多次修理无法解决,发动机故障灯亮人员技术多次返修,2020-06-21 09:49:57.122,处理反馈
477854,长安马自达,2016款 1.5L 手动 豪华型 三厢,长安马自达昂克赛拉中控屏幕开裂,车身附件及电器部件开裂服务态度不解决问题,2020-06-21 09:49:57.133,处理反馈
477852,上汽通用别克,2011款 1.6 手动 LX,别克凯越中控仪表台脱胶开裂影响驾驶安全,车身附件及电器仪表台开裂,2020-06-21 09:49:57.143,处理反馈
477851,一汽-大众,2019款 280TSI DSG 舒适型 国VI,一汽大众速腾方向盘底部传动杆生锈,车身附件及电器车身生锈,2020-06-21 09:49:57.153,用户评分
477849,长城汽车,2019款 1.5T 两驱 极智科技版,哈弗F7x车身B柱位置异响多次维修未解决,车身附件及电器车身异响,2020-06-21 09:49:57.162,处理反馈
477847,广汽本田,2020款 240TURBO CVT 两驱 精英版,广汽本田皓影自动大灯太灵敏发动机舱内进泥,车身附件及电器车灯模块故障其他疑似设计缺陷,2020-06-21 09:49:57.172,处理反馈
477843,一汽-大众,2018款 1.5L 自动 时尚型,一汽大众宝来发动机爆震更换活塞后再次爆震,发动机爆震,2020-06-21 09:49:57.196,用户评分
477842,一汽-大众,2019款 280TSI DSG 两驱 舒适型 国V,一汽大众探歌韩泰轮胎老化存在安全隐患,轮胎开裂,2020-06-21 09:49:58.019,处理反馈
477841,上汽大众,2019款 330TSI 豪华版 国VI,上汽大众帕萨特变速箱顿挫异响要求更换总成,变速器异响变速器顿挫,2020-06-21 09:49:58.038,处理反馈
477840,东风雷诺,2019款 TCe270 自动 劲擎型,东风雷诺科雷缤购车提供基础流量未兑现,承诺不兑现销售承诺不兑现服务流程不完善服务网点少,2020-06-21 09:49:58.047,信息审核
477839,东风本田,2017款 210TURBO CVT 豪华版 5座,东风本田杰德车身多处位置生锈腐蚀,车身附件及电器车身生锈,2020-06-21 09:49:58.060,处理反馈
477837,一汽丰田,2019款 双擎 2.5L 豪华版 国Ⅵ,一汽丰田亚洲龙机油增多存在有汽油味,发动机机油增多,2020-06-21 09:49:58.072,用户评分
477835,长安马自达,2013款 2.5L 自动 四驱豪华型,长安马自达CX-5主驾驶座椅靠背框架断裂,车身附件及电器部件开裂车身附件及电器座椅故障,2020-06-21 09:49:58.092,处理反馈
477833,江淮汽车,2016款 1.6L 豪华型 宜家版,江淮瑞风M3右后轮半轴轴承出现质量问题,前后桥及悬挂系统车轮异响,2020-06-21 09:49:58.104,用户评分
477832,吉利汽车,2019款 350T 耀星者,吉利星越车机版本与宣传不符机油量无法显示,其他疑似设计缺陷,2020-06-21 09:49:58.114,处理反馈
477829,一汽-大众,2017款 1.4L 手动 时尚型,一汽大众捷达四条韩泰轮胎排水槽处有裂纹,轮胎开裂,2020-06-21 09:49:58.123,用户评分
477825,一汽-大众,2019款 200TSI DSG 舒适型 国VI,一汽大众速腾无上坡辅助功能导致上坡溜车,变速器异响销售欺诈与宣传不符,2020-06-21 09:49:58.151,用户评分
477823,一汽-大众,2019款 280TSI DSG 舒适型 国VI,一汽大众速腾上坡辅助系统与宣传不符,销售欺诈与宣传不符,2020-06-21 09:49:58.164,处理反馈
477822,长安福特,2017款 1.5L 自动 时尚型 幸福版,长安福特福睿斯经销商偷拔电子扇插座,人员技术操作不规范,2020-06-21 09:49:58.172,用户评分
477819,长城汽车,2019款 灵智版 351km,欧拉R1主驾驶侧车门漆面无故爆裂,车身附件及电器漆面起泡开裂,2020-06-21 09:49:58.183,处理反馈
477817,北京现代,2019款 380 TGDi DLX 自动 两驱 智尊版PLUS 国V,北京现代胜达车门开关时存在明显异响,车身附件及电器门窗异响,2020-06-21 09:49:58.192,用户评分
477816,北京汽车,2019款 1.5L 手动 豪华版 国V,绅宝D50发动机盖漆面无故脱落希望尽快解决,车身附件及电器漆面起泡开裂,2020-06-21 09:49:58.200,用户评分
477814,上汽大众,2019款 380TSI 自动 四驱 智动豪华版 国VI,上汽大众途观L经销商私自改装车辆 变更价格,服务态度厂家不回复服务收费价格不透明销售欺诈低配当高配卖配件争议使用非原厂件,2020-06-21 09:49:58.210,处理反馈
477812,长安福特,2012款 1.6 自动 风尚型 三厢,长安福特福克斯变速箱挂D挡后加油不动,变速器无法加速,2020-06-21 09:49:58.220,处理反馈
477811,东风英菲尼迪,2015款 2.0T 自动 悦享版,东风英菲尼迪Q50L凸轮轴位移调节器损坏,车身附件及电器传感器故障,2020-06-21 09:49:58.231,信息审核
477810,一汽-大众,2017款 330TSI DSG 领先型,一汽大众迈腾变速箱机电控制单元损坏,变速器滑阀箱故障,2020-06-21 09:49:58.242,用户评分
477808,上汽大众,2019款 改款 330TSI 自动 两驱 R-Line旗舰版 国VI,上汽大众途观L 4S店出售瑕疵车未告知,销售欺诈出售问题车,2020-06-21 09:49:58.251,用户评分
477807,一汽-大众奥迪,2020款 40 TFSI 豪华动感型,一汽大众奥迪A6L低速行驶变速箱抖动异响,变速器异响变速器抖动,2020-06-21 09:49:58.265,信息审核
477805,猎豹汽车,2017款 2.0T 自动 都市型,猎豹CS10多媒体主机故障 厂家无配件,车身附件及电器影音系统故障配件争议无零配件,2020-06-21 09:49:58.276,信息审核
477804,上汽大众,2015款 230TSI 手动 风尚版,上汽大众凌渡发动机高压油泵异响严重,发动机异响,2020-06-21 09:49:58.287,处理反馈
477802,吉利汽车,2020款 1.5L CVT 亚运版,吉利远景厂家减配胎压监测系统,其他疑似减配,2020-06-21 09:49:58.297,用户评分
477801,上汽通用别克,2011款 1.6 自动 LX,别克凯越仪表台脱胶影响驾驶安全,车身附件及电器仪表台开裂,2020-06-21 09:49:58.308,处理反馈
477800,广汽本田,2018款 1.5L CVT 舒适版,广汽本田飞度4S店服务承诺不兑现,人员技术修出新问题承诺不兑现服务承诺不兑现,2020-06-21 09:49:58.319,处理反馈
477799,上汽通用雪佛兰,2018款 530T 豪华版,雪佛兰迈锐宝中控屏异常 重启打不开,车身附件及电器影音系统故障,2020-06-21 09:49:58.331,处理反馈
477798,东风标致,2014款 1.8L 自动 豪华版,东风标致408发动机烧机油 厂家不予索赔,发动机烧机油服务态度不予索赔,2020-06-21 09:49:58.348,处理反馈
477797,上汽通用别克,2019款 28T 豪华型,别克君越发动机抖动 悬挂及车门异响,发动机抖动前后桥及悬挂系统底盘异响前后桥及悬挂系统悬挂故障车身附件及电器门窗异响,2020-06-21 09:49:58.359,处理反馈
477794,北京奔驰,2020款 GLC 300 L 4MATIC 动感型,北京奔驰GLC空调噪音大 突然自动刹车,制动系统刹车失灵车身附件及电器空调问题,2020-06-21 09:49:58.369,处理反馈
477793,一汽-大众,2020款 280TSI DSG 两驱 R-Line Pro,一汽大众探歌变速箱手动模式降挡异响顿挫,变速器异响变速器顿挫,2020-06-21 09:49:59.205,用户评分
477792,上汽通用别克,2008款 1.6 手动 LE,别克凯越中控仪表台脱胶开裂影响安全及美观,车身附件及电器仪表台开裂,2020-06-21 09:49:59.215,用户评分
477791,东风裕隆,2016款 1.6L CVT 智享型,纳智捷锐3发动机运转时气门有异响,发动机气门故障,2020-06-21 09:49:59.229,厂家受理
477790,猎豹汽车,2017款 2.0T 自动 豪华型,猎豹CS10行驶过程中变速箱有异响,变速器异响,2020-06-21 09:49:59.244,信息审核
477789,北京奔驰,2013款 260 优雅型 Grand Edition,北京奔驰C级发动机启动延迟 故障灯亮,发动机故障灯亮发动机无法启动,2020-06-21 09:49:59.256,信息审核
477788,上汽通用别克,2017款 15N 自动 精英型,别克英朗发动机多处出现漏油的现象,发动机漏油,2020-06-21 09:49:59.268,用户评分
477787,东风日产,2014款 1.6L XV CVT 尊享版,东风日产轩逸变速箱和发动机故障灯亮,发动机故障灯亮变速器故障灯亮,2020-06-21 09:49:59.278,用户评分
477784,奇瑞汽车,2014款 1.6L 手动 智尚版 5座,奇瑞瑞虎3四个车门门槛处漆面爆漆生锈,车身附件及电器车身生锈车身附件及电器漆面起泡开裂,2020-06-21 09:49:59.287,处理反馈
477783,一汽-大众,2015款 1.4TSI 自动 舒适型,一汽大众高尔夫变速箱挡杆损坏导致故障灯亮,变速器故障灯亮变速器挡把总成故障,2020-06-21 09:49:59.297,处理反馈
477780,长安福特,2013款 1.5T 自动 GTDi180时尚型,长安福特蒙迪欧进气管内有机油 油箱加不满,发动机漏油车身附件及电器油箱有缺陷,2020-06-21 09:49:59.305,用户评分
477777,东风本田,2017款 1.5L LXi CVT 经典版,东风本田XR-V副驾驶侧仪表板处有异响,车身附件及电器中控台异响,2020-06-21 09:49:59.314,处理反馈
477776,一汽丰田,2020款 2.0L CVT 两驱 风尚版,一汽丰田RAV4荣放交了保险费后未上保险,承诺不兑现销售承诺不兑现,2020-06-21 09:49:59.324,用户评分
477773,一汽-大众,2019款 200TSI DSG 舒适型 国VI,一汽大众速腾车辆无上坡辅助系统与宣传不符,销售欺诈与宣传不符,2020-06-21 09:49:59.333,处理反馈
477772,上汽通用别克,2017款 15N 手动 精英型,别克英朗离合器渗油维修后离合器有异响,离合器异响离合器漏油,2020-06-21 09:49:59.342,用户评分
477771,一汽丰田,2019款 双擎 2.5L 豪华版 国Ⅵ,一汽丰田亚洲龙发动机机油增多超过上限,发动机机油增多,2020-06-21 09:49:59.352,处理反馈
477770,吉利汽车,2017款 1.5L 手动 幸福版,吉利远景安全带吊环自然开裂影响使用,车身附件及电器部件开裂车身附件及电器安全带故障,2020-06-21 09:49:59.360,处理反馈
477768,一汽-大众,2019款 280TSI DSG 舒适型 国VI,一汽大众速腾实车功能与官方宣传不符,车身附件及电器行车安全辅助系统故障销售欺诈与宣传不符,2020-06-21 09:49:59.369,用户评分
477767,东风标致,2014款 1.8L 自动 豪华版,东风标致408空调不出风影响使用,车身附件及电器空调问题,2020-06-21 09:49:59.379,处理反馈
477765,北京现代,2019款 1.5L CVT 智炫·精英型,北京现代领动方向盘异响 4S店收取续保押金,转向系统异响服务收费变相收费,2020-06-21 09:49:59.391,用户评分
477764,众泰汽车,2017款 1.8T 双离合 尊享型,众泰T700变速箱脱挡 P挡闪烁无法解决,变速器故障灯亮变速器脱挡,2020-06-21 09:49:59.401,处理反馈
477763,吉利汽车,2019款 300T 耀星者,吉利星越更换喇叭时将叶子板损坏且态度恶劣,服务态度态度蛮横人员技术修出新问题,2020-06-21 09:49:59.411,用户评分
477762,一汽-大众奥迪,2018款 quattro 2.0T 个性运动版 30周年年型,一汽大众奥迪A4L车门异响 空调异味,车身附件及电器门窗异响车身附件及电器空调异味,2020-06-21 09:49:59.422,信息审核
477761,东风日产,2017款 2.0L CVT 精英版 国V,东风日产逍客发动机灯亮 变速箱抖动,发动机故障灯亮变速器抖动,2020-06-21 09:49:59.431,用户评分
477760,一汽马自达,2020款 2.5L 蓝天运动版,一汽马自达阿特兹A柱B柱及中控异响,车身附件及电器中控台异响车身附件及电器车身异响,2020-06-21 09:49:59.440,处理反馈
477753,一汽丰田,2018款 2.0L 奕炫天窗版 国V,一汽丰田奕泽电瓶亏电 天窗异响,车身附件及电器电瓶故障车身附件及电器天窗异响,2020-06-21 09:49:59.449,用户评分
477747,上汽大众,2011款 1.4TSI DSG 智雅版 5座,上汽大众途安变速器漏油 倒挡拨叉断裂,变速器漏油变速器抖动变速器脱挡,2020-06-21 09:49:59.457,处理反馈
477746,北京越野,2016款 1.5T CVT 豪华型,北京20打方向异响高速行驶中方向盘沉重,转向系统异响转向系统打方向沉重,2020-06-21 09:49:59.467,处理反馈
477745,东风本田,2019款 220TURBO CVT 劲动版 国VI,东风本田思域玛吉斯轮胎开裂4S店拒绝索赔,轮胎开裂,2020-06-21 09:49:59.477,处理反馈
477744,一汽-大众,2018款 180TSI 双离合 臻享版,一汽大众速腾高压油泵异响更换后未解决,发动机异响,2020-06-21 09:49:59.489,处理反馈
477743,一汽-大众,2019款 280TSI DSG 舒适型 国VI,一汽大众速腾坡道辅助与宣传不符影响安全,车身附件及电器行车安全辅助系统故障销售欺诈与宣传不符,2020-06-21 09:49:59.500,用户评分
477741,华晨宝马,2020款 325Li xDrive M运动套装,华晨宝马3系变速箱换挡异响 低速行驶顿挫,变速器异响变速器顿挫,2020-06-21 09:50:00.289,处理反馈
477737,东风日产,2017款 2.5L XL 两驱 智尚版,东风日产楼兰油泵异响出现低频噪音,车身附件及电器汽油泵故障,2020-06-21 09:50:00.304,处理反馈
477736,一汽奔腾,2019款 230 TID 自动 豪华型 国VI,一汽奔腾T77发动机故障灯一直亮,发动机故障灯亮,2020-06-21 09:50:00.313,处理反馈
477734,奥迪（进口）,2019款 45 TFSI S line运动型,奥迪Q7通电状态下喇叭持续发出电流声,车身附件及电器影音系统故障,2020-06-21 09:50:00.324,用户评分
477733,蔚来,2019款 420KM 运动版,蔚来ES6方向盘异响 摄像头模糊 车机断网,转向系统异响车身附件及电器影音系统故障车身附件及电器车载互联故障,2020-06-21 09:50:00.334,信息审核
477729,吉利汽车,2019款 1.5TD MHEV DCT 尊享型,吉利嘉际车内氛围灯与厂家宣传不符,销售欺诈与宣传不符,2020-06-21 09:50:00.346,处理反馈
477728,一汽-大众奥迪,2019款 40 TFSI 时尚型 国VI,一汽大众奥迪A4L变速箱功能受限无倒挡,变速器无法换挡变速器故障灯亮,2020-06-21 09:50:00.357,信息审核
477723,长安汽车,2017款 1.5T 手动 豪擎版 CX70T,长安欧尚CX70涡轮增压器故障导致发动机异响,发动机异响发动机涡轮增压器故障,2020-06-21 09:50:00.368,处理反馈
477721,东风本田,2015款 1.5L LXi CVT经典版,东风本田XR-V冷启动时发动机异响严重,发动机异响,2020-06-21 09:50:00.377,用户评分
477720,一汽丰田,2014款 1.6L CVT GL-i真皮版,一汽丰田卡罗拉空调压缩机损坏希望厂家处理,车身附件及电器空调问题,2020-06-21 09:50:00.387,用户评分
477719,北汽新能源,2018款 EX360 新尚版,北汽新能源EX系列充电时断电希望厂家处理,车身附件及电器充电故障,2020-06-21 09:50:00.398,处理反馈
477717,长安汽车,2018款 1.6L GDI 自动 风潮型 国V,长安逸动XT排气管无隔热瓦导致车内高温,其他疑似设计缺陷,2020-06-21 09:50:00.407,处理反馈
477715,奇瑞汽车,2018款 1.5T 自动 悦行版,捷途X70发动机漏油希望厂家处理问题,发动机漏油,2020-06-21 09:50:00.416,用户评分
477714,一汽-大众,2019款 280TSI DSG 舒适型 国VI,一汽大众速腾上坡辅助系统与宣传不符,车身附件及电器行车安全辅助系统故障销售欺诈与宣传不符,2020-06-21 09:50:00.424,处理反馈
477712,江铃汽车,2017款 2.8T 商运型 短轴 中顶 6/7/8座 JX493,江铃特顺发动机和SVS黄色故障灯亮,发动机故障灯亮,2020-06-21 09:50:00.432,用户评分
477708,广汽本田,2018款 230TURBO 舒适版 国VI,广汽本田雅阁高速行驶中速度突然下降,发动机功率不足,2020-06-21 09:50:00.442,处理反馈
477707,上汽斯柯达,2019款 TSI280 智行豪华版 国Ⅵ,斯柯达柯珞克电瓶故障导致无法启动,车身附件及电器电瓶故障,2020-06-21 09:50:00.451,用户评分
477704,一汽-大众奥迪,2019款 40 TFSI 进取型 国V,一汽大众奥迪A4L变速箱异响严重,变速器异响,2020-06-21 09:50:00.459,用户评分
477703,上汽大众,2015款 280TSI DSG 舒适版,上汽大众凌渡变速箱故障导致无法加速,变速器无法加速,2020-06-21 09:50:00.468,处理反馈
477702,一汽-大众,2019款 280TSI DSG 舒适型 国VI,一汽大众速腾无坡道辅助功能 变速箱异响,变速器异响销售欺诈与宣传不符,2020-06-21 09:50:00.477,处理反馈
477701,吉利汽车,2017款 1.3T 自动 旗舰型,吉利帝豪GL自适应巡航故障 座椅歪斜,车身附件及电器座椅故障车身附件及电器定速巡航故障,2020-06-21 09:50:00.487,用户评分
477700,东风日产,2018款 1.6XV CVT 尊享版,东风日产轩逸大灯罩存在瑕疵影响照明,车身附件及电器灯罩裂纹或变形,2020-06-21 09:50:00.496,用户评分
477698,华晨中华,2013款 1.5L 自动 豪华型,华晨中华H330无法读取OBD要求处理,车身附件及电器行车电脑故障,2020-06-21 09:50:00.510,用户评分
477696,上汽大众,2018款 330TSI 自动 两驱 豪华版 改款,上汽大众途观L吃胎偏磨影响安全行驶,前后桥及悬挂系统吃胎偏磨,2020-06-21 09:50:00.518,处理反馈
477693,上汽通用凯迪拉克,2020款 28T 豪华型,凯迪拉克CT5发动机故障灯报警并且漏气,发动机故障灯亮,2020-06-21 09:50:00.531,处理反馈
477691,猎豹汽车,2018款 1.6T GDI DCT 精英型,猎豹Mattu发动机故障灯亮 动力消失,发动机故障灯亮发动机动力消失,2020-06-21 09:50:00.541,用户评分
477690,吉利汽车,2020款 1.8TD DCT 智尊PRO,吉利博越挂R挡倒车会有异响希望解决,变速器异响,2020-06-21 09:50:00.552,用户评分
477689,吉利汽车,2019款 350T 驭星者,吉利星越雾灯进水 车机卡顿与宣传不符,车身附件及电器车灯进水销售欺诈与宣传不符,2020-06-21 09:50:00.561,处理反馈
477688,一汽-大众,2020款 330TSI 魅颜版 国VI,一汽大众CC变速箱异响 天窗异响,变速器异响车身附件及电器天窗异响,2020-06-21 09:50:00.573,用户评分
477684,众泰汽车,2017款 1.5L 手动 豪华型,众泰T300经销商倒闭车辆无法维修,服务流程不完善服务网点少,2020-06-21 09:50:00.582,处理反馈
477683,长城汽车,2018款 2.0T 自动 豪华型 换代 蓝标,哈弗H6加速无力车身抖动希望处理,发动机抖动发动机故障灯亮发动机功率不足,2020-06-21 09:50:01.346,处理反馈
477678,上汽通用雪佛兰,2013款 1.4L 手动 优逸幸福版 三厢,雪佛兰赛欧车身生锈严重存在安全隐患,车身附件及电器车身生锈,2020-06-21 09:50:01.353,处理反馈
477677,一汽-大众,2019款 200TSI 手动 舒适型 国VI,一汽大众速腾陡坡起步辅助功能与宣传不符,销售欺诈与宣传不符,2020-06-21 09:50:01.363,处理反馈
477675,长安福特,2018款 EcoBoost 245 四驱 尊锐型Plus 7座 国V,长安福特锐界保养售后未提供保养记录,人员技术操作不规范,2020-06-21 09:50:01.373,用户评分
477674,一汽-大众,2019款 280TSI DSG 舒适型 国VI,一汽大众速腾无上坡辅助功能 与宣传不符,变速器异响销售欺诈与宣传不符,2020-06-21 09:50:01.384,处理反馈
477673,长安汽车,2012款 1.0L 手动 时尚版 国IV,长安奔奔MINI颠簸路面行驶方向机异响,转向系统异响转向系统转向机故障,2020-06-21 09:50:01.394,处理反馈
477672,广汽丰田,2019款 2.5G 豪华版 国VI,广汽丰田凯美瑞4S店喷漆水平极差,人员技术维修技术差,2020-06-21 09:50:01.404,用户评分
477671,上汽通用雪佛兰,2013款 1.6L SL 手动,雪佛兰科鲁兹行驶过程中方向盘抱死,转向系统失灵,2020-06-21 09:50:01.414,处理反馈
477670,一汽马自达,2020款 2.5L 蓝天运动版,一汽马自达阿特兹副驾驶B柱异响影响驾驶,车身附件及电器车身异响,2020-06-21 09:50:01.422,用户评分
477669,广汽丰田,2017款 185T CVT 精英版 国V 改款,广汽丰田雷凌倒车影像画面变形影响驾驶,车身附件及电器影音系统故障,2020-06-21 09:50:01.431,用户评分
477668,东风雪铁龙,2017款 350THP 豪华型,东风雪铁龙C6涡轮增压进气管脱落厂家不解决,发动机涡轮增压器故障服务态度厂家不回复,2020-06-21 09:50:01.441,用户评分
477667,奇瑞捷豹路虎,2019款 240PS SE版 国VI,奇瑞捷豹路虎发现神行减震器过硬水泵损坏,发动机水泵故障变速器漏油前后桥及悬挂系统减震器过硬,2020-06-21 09:50:01.453,用户评分
477666,一汽-大众奥迪,2019款 40 TFSI 时尚型 国VI,一汽大众奥迪A4L怠速时车身抖动严重,车身附件及电器车身共振,2020-06-21 09:50:01.464,信息审核
477665,吉利汽车,2019款 260T DCT 骑士 国VI,吉利缤越4S店免费洗车承诺不兑现,承诺不兑现服务承诺不兑现,2020-06-21 09:50:01.472,处理反馈
