投诉编号,投诉品牌,投诉车系,问题简述,典型问题,投诉时间,投诉状态
480508,北京现代,2016款 1.6L 自动 智炫·精英型,北京现代领动两前大灯灯罩开裂不保修,车身附件及电器灯罩裂纹或变形,2020-06-21 09:48:50.864,用户评分
480507,一汽马自达,2020款 2.5L 蓝天运动版,一汽马自达阿特兹A柱与B柱异响希望处理,车身附件及电器车身异响,2020-06-21 09:48:51.743,处理反馈
480504,东风标致,2013款 1.6T 自动 THP至尚版,东风标致3008空调压缩机不制冷 发动机异响,发动机异响车身附件及电器空调问题,2020-06-21 09:48:51.775,处理反馈
480503,东风日产,2016款 1.6L CVT 智酷版,东风日产蓝鸟互联偶尔失灵 车机断电,车身附件及电器影音系统故障车身附件及电器车载互联故障车身附件及电器灯罩裂纹或变形,2020-06-21 09:48:51.788,处理反馈
480501,一汽马自达,2020款 2.5L 蓝天尊崇版,一汽马自达阿特兹天窗与B柱异响严重,车身附件及电器车内异响车身附件及电器天窗异响,2020-06-21 09:48:51.796,处理反馈
480500,一汽马自达,2020款 2.0L 自动 两驱 蓝天活力版,一汽马自达CX-4 A柱B柱C柱及中控异响,车身附件及电器中控台异响车身附件及电器车身异响,2020-06-21 09:48:51.808,处理反馈
480499,广汽菲克Jeep,2017款 200TS 自动 高性能四驱版,广汽菲克Jeep指南者烧机油厂家推诿未解决,发动机烧机油服务态度互相推诿,2020-06-21 09:48:51.819,厂家受理
480498,一汽马自达,2020款 2.5L 蓝天尊崇版,一汽马自达阿特兹全车多处异响希望解决,车身附件及电器车身异响,2020-06-21 09:48:51.836,用户评分
480495,众泰汽车,2017款 2.0T 自动 极致之梦版,众泰SR9保修期内变速箱频繁故障,变速器故障灯亮,2020-06-21 09:48:51.849,用户评分
480492,一汽马自达,2020款 2.5L 蓝天尊崇版,一汽马自达阿特兹B柱异响 后备箱异响,车身附件及电器车身异响,2020-06-21 09:48:51.859,处理反馈
480491,一汽-大众,2017款 330TSI DSG 领先型,一汽大众迈腾低速或原地转向异响,转向系统异响,2020-06-21 09:48:51.871,处理反馈
480489,一汽马自达,2020款 2.5L 蓝天运动版,一汽马自达阿特兹A柱异响 车顶异响,车身附件及电器车身异响,2020-06-21 09:48:51.881,处理反馈
480487,广汽本田,2014款 1.5L CVT SE时尚型,广汽本田飞度冷启动时发动机异响,发动机异响,2020-06-21 09:48:51.890,处理反馈
480485,一汽马自达,2020款 2.5L 蓝天运动版,一汽马自达阿特兹B柱及天窗异响,车身附件及电器车身异响车身附件及电器天窗异响,2020-06-21 09:48:51.899,处理反馈
480482,上汽通用别克,2016款 28T 自动 四驱精英型,别克昂科威后差速器左侧油封漏油不保修,前后桥及悬挂系统差速器漏油服务态度不予索赔,2020-06-21 09:48:51.910,处理反馈
480481,长安汽车,2017款 1.5L 手动 标准型,长安欧尚A600主驾驶位置有螺丝脱落,车身附件及电器部件开裂,2020-06-21 09:48:51.920,处理反馈
480478,领克汽车,2018款 1.5TD DCT 劲Pro版 国V,领克03车辆360影像显示画面变形,车身附件及电器影音系统故障,2020-06-21 09:48:51.931,处理反馈
480477,一汽马自达,2020款 2.5L 蓝天运动版,一汽马自达阿特兹B柱异响 中控异响,车身附件及电器车身共振车身附件及电器中控台异响,2020-06-21 09:48:51.949,处理反馈
480476,一汽马自达,2020款 2.5L 蓝天尊崇版,一汽马自达阿特兹车身以及车内异响,车身附件及电器车内异响车身附件及电器车身异响,2020-06-21 09:48:51.960,用户评分
480475,一汽-大众,2019款 330TSI 两驱 豪华型 国Ⅵ,一汽大众探岳油泵接头渗油希望尽快处理,发动机漏油,2020-06-21 09:48:51.970,处理反馈
480473,东风标致,2014款 1.8L 自动 豪华版,东风标致408后桥异响4S店未处理,前后桥及悬挂系统前后桥异响服务态度不解决问题服务态度不予索赔,2020-06-21 09:48:51.981,处理反馈
480472,一汽马自达,2020款 2.5L 蓝天运动版,一汽马自达阿特兹车内多处异响未解决,车身附件及电器车内异响服务态度不解决问题,2020-06-21 09:48:51.990,用户评分
480471,东风标致,2017款 380THP 精英版 7座,东风标致5008轮毂腐蚀希望尽快处理,车身附件及电器轮毂问题,2020-06-21 09:48:52.002,处理反馈
480470,东风裕隆,2017款 1.6T 新创型 改款,纳智捷优6 SUV涡轮增压器异响要求处理,发动机涡轮增压器故障,2020-06-21 09:48:52.012,厂家受理
480469,广汽丰田,2019款 2.5G 豪华版 国VI,广汽丰田凯美瑞4S店喷漆水平极差,人员技术维修技术差,2020-06-21 09:48:52.022,用户评分
480468,吉利汽车,2019款 260T DCT 骑士 国VI,吉利缤越A柱风噪大 车机系统无法升级,车身附件及电器门窗漏风承诺不兑现服务承诺不兑现,2020-06-21 09:48:52.033,处理反馈
480466,一汽马自达,2020款 2.5L 蓝天尊崇版,一汽马自达阿特兹ABC柱异响 中控异响,车身附件及电器中控台异响车身附件及电器车身异响,2020-06-21 09:48:52.043,处理反馈
480465,一汽马自达,2020款 2.5L 蓝天运动版,一汽马自达阿特兹B柱及C柱位置异响,车身附件及电器车身异响,2020-06-21 09:48:52.054,用户评分
480464,奥迪（进口）,2019款 45 TFSI 舒适型,进口奥迪Q7空调严重化学异味希望尽快解决,车身附件及电器空调异味,2020-06-21 09:48:52.066,信息审核
480463,广汽丰田,2012款 凯美瑞 2.5G 自动 豪华版,广汽丰田凯美瑞半轴防尘套漏油严重,前后桥及悬挂系统半轴渗油,2020-06-21 09:48:52.078,处理反馈
480461,北京现代,2018款 1.6L 自动 悦目版 GL 国VI,北京现代悦动发动机启动困难希望厂家处理,发动机无法启动,2020-06-21 09:48:52.088,处理反馈
480459,一汽马自达,2020款 2.0L 蓝天豪华版,一汽马自达阿特兹A柱B柱及中控异响,车身附件及电器中控台异响车身附件及电器车身异响,2020-06-21 09:48:53.062,用户评分
480458,上汽通用凯迪拉克,2020款 28T 四驱 豪华型,凯迪拉克XTS转向刹车失效不予退车,服务流程不完善活动不通知服务流程不完善未经同意维修,2020-06-21 09:48:53.076,处理反馈
480456,长安马自达,2019款 云控版 三厢 1.5L 自动 舒适型 国VI,长安马自达昂克赛拉4S店维修时车漆剐蹭受损,服务态度不解决问题服务态度互相推诿人员技术粗心大意,2020-06-21 09:48:53.087,处理反馈
480455,北汽银翔,2017款 1.3T 手动 尊贵型,北汽幻速S5球笼套漏油ABS泵故障维修无配件,制动系统ABS故障前后桥及悬挂系统球笼套漏油配件争议无零配件,2020-06-21 09:48:53.095,信息审核
480453,长城汽车,2013款 1.5L 手动 豪华型,长城C30车身漆面生锈4S店不解决,车身附件及电器车身生锈车身附件及电器漆面起泡开裂服务态度不解决问题,2020-06-21 09:48:53.108,处理反馈
480452,上汽通用别克,2018款 18T 自动 精英型,别克英朗蓄电池故障导致发动机无法启动,车身附件及电器电瓶故障,2020-06-21 09:48:53.118,处理反馈
480450,上汽通用别克,2019款 18T 互联尊贵型 6座 国VI,别克GL6发动机冷启动异响支撑杆磨损车漆,发动机异响车身附件及电器后备箱故障服务态度不解决问题服务态度厂家不回复服务态度故意拖延,2020-06-21 09:48:53.127,用户评分
480449,沃尔沃亚太,2020款 T3 智行豪华版,亚太沃尔沃S60发动机启动困难希望厂家处理,发动机无法启动,2020-06-21 09:48:53.141,处理反馈
480448,奇瑞汽车,2018款 1.5T 手动 悦行版,捷途X70保养时加入机油售后操作不规范,人员技术操作不规范,2020-06-21 09:48:53.152,处理反馈
480447,长安福特,2017款 1.5L 手动 舒适型,长安福特福睿斯大梁生锈希望厂家处理,车身附件及电器车身生锈,2020-06-21 09:48:53.162,用户评分
480446,东风风度,轻型普通货车,东风途逸发动机动力不足容易出现熄火,发动机熄火发动机无法启动发动机动力消失,2020-06-21 09:48:53.171,信息审核
480445,东风雪铁龙,2014款 1.8L 手动 智驱版 劲智型,东风雪铁龙C4L打方向沉重松动有间隙,转向系统打方向沉重转向系统方向盘自由间隙过大,2020-06-21 09:48:53.179,处理反馈
480444,众泰汽车,2018款 飞鱼座,众泰E200中控显示屏黑屏存在质量问题,车身附件及电器影音系统故障,2020-06-21 09:48:53.190,信息审核
480440,长安福特,2015款 1.6L 自动 舒适型 三厢,长安福特福克斯踩油门时变速箱抖动,变速器抖动,2020-06-21 09:48:53.199,处理反馈
480439,广汽丰田,2019款 185T CVT 豪华版 国VI,广汽丰田雷凌变速箱顿挫厂家推诿未解决,变速器顿挫服务态度不解决问题服务态度互相推诿,2020-06-21 09:48:53.208,处理反馈
480438,上汽通用别克,2019款 20T 双离合 领先型 三厢,别克威朗电池亏电导致发动机无法启动,车身附件及电器电瓶故障,2020-06-21 09:48:53.217,处理反馈
480437,一汽丰田,2017款 1.6L S-CVT GL 改款,一汽丰田卡罗拉车辆信息存在维修记录,销售欺诈出售问题车,2020-06-21 09:48:53.226,信息审核
480433,北京现代,2018款 1.6L 自动 悦目版 GL 国V,北京现代悦动发动机启动困难升级程序未解决,发动机无法启动人员技术查不出原因,2020-06-21 09:48:53.234,处理反馈
480430,比亚迪,2015款 1.5T 双离合 双冠旗舰版,比亚迪秦新能源续航里程衰退厂家不解决,车身附件及电器动力电池故障服务态度不解决问题服务态度不予索赔,2020-06-21 09:48:53.243,处理反馈
480429,一汽马自达,2020款 2.5L 蓝天运动版,一汽马自达阿特兹车身B柱异响厂家未解决,车身附件及电器车内异响车身附件及电器车身异响,2020-06-21 09:48:53.253,用户评分
480428,广汽乘用车,2020款 270T 自动 智联科技版,广汽传祺GS4行驶中方向跑偏维修未解决,前后桥及悬挂系统跑偏,2020-06-21 09:48:53.266,处理反馈
480427,一汽马自达,2020款 2.5L 蓝天尊崇版,一汽马自达阿特兹车身AB柱及天窗异响,车身附件及电器车内异响车身附件及电器车身异响车身附件及电器天窗异响,2020-06-21 09:48:53.275,处理反馈
480426,一汽-大众,2019款 280TSI DSG 舒适型 国VI,一汽大众速腾坡道辅助功能失效要求厂家解决,车身附件及电器行车安全辅助系统故障销售欺诈与宣传不符,2020-06-21 09:48:53.285,处理反馈
480425,上汽通用五菱,2019款 1.5T CVT 豪华型 7座 国V,宝骏530空调不制冷售后未解决问题,车身附件及电器空调问题,2020-06-21 09:48:53.293,处理反馈
480423,长安福特,2014款 1.0 劲动型 GTDi  两厢,长安福特嘉年华低速加油车抖动厉害,离合器抖动服务态度不予索赔人员技术多次返修,2020-06-21 09:48:53.301,处理反馈
480421,北京现代,2011款 1.4L 手动 舒适型 GS 两厢,北京现代瑞纳车身侧裙生锈希望厂家质保,车身附件及电器车身生锈,2020-06-21 09:48:53.309,用户评分
480420,一汽马自达,2020款 2.5L 蓝天尊崇版,一汽马自达阿特兹车内多处异响厂家未回复,车身附件及电器影音系统故障车身附件及电器中控台异响车身附件及电器车身异响服务态度厂家不回复,2020-06-21 09:48:53.318,用户评分
480419,上汽通用凯迪拉克,2020款 28T 铂金运动版,凯迪拉克CT5变速箱异响售后未解决问题,变速器异响,2020-06-21 09:48:53.327,用户评分
480418,东风本田,2019款 220TURBO CVT 劲动版 国VI,东风本田思域坐垫卡子损坏螺丝有拧动痕迹,车身附件及电器部件开裂车身附件及电器部件异常磨损服务态度不解决问题,2020-06-21 09:48:53.340,用户评分
480417,上汽通用别克,2017款 15S 自动 领先型 三厢,别克威朗车载互联功能无法连接手机,车身附件及电器车载互联故障,2020-06-21 09:48:53.350,处理反馈
480416,上汽通用五菱,2018款 1.5L 实用型,上汽通用五菱荣光V空调压缩机无故爆裂,车身附件及电器电瓶故障,2020-06-21 09:48:54.308,用户评分
480415,一汽-大众奥迪,2019款 40 TFSI 时尚型 国VI,一汽大众奥迪A4L副驾驶车门胶条脱落,车身附件及电器密封条损坏,2020-06-21 09:48:54.324,信息审核
480414,上汽大众,2015款 280TSI DSG 豪华版,上汽大众凌渡变速箱故障无法加速不给解决,变速器无法加速变速器电脑板故障服务态度不予索赔,2020-06-21 09:48:54.335,用户评分
480413,一汽马自达,2020款 2.5L 蓝天运动版,一汽马自达阿特兹中控台 ABC柱异响,车身附件及电器中控台异响车身附件及电器车身异响,2020-06-21 09:48:54.346,处理反馈
480412,上汽大通,2019款 1.5T 自动 精英版 国V,上汽MAXUS G50购车时经销商收取服务费,服务收费变相收费服务收费价格不透明,2020-06-21 09:48:54.355,处理反馈
480411,上汽通用别克,2015款 1.5L 自动 经典型,别克凯越中控仪表台脱胶翘起存在质量问题,车身附件及电器仪表台开裂,2020-06-21 09:48:54.368,处理反馈
480410,一汽马自达,2020款 2.0L 自动 两驱 蓝天品位版,一汽马自达CX-4车身异响颠簸路中控台异响,车身附件及电器中控台异响车身附件及电器车身异响服务态度不解决问题,2020-06-21 09:48:54.379,用户评分
480409,广汽丰田,2019款 185T CVT 豪华版 国VI,广汽丰田雷凌购车缴纳定金销售活动未通知,承诺不兑现销售承诺不兑现服务流程不完善活动不通知,2020-06-21 09:48:54.391,用户评分
480408,上汽通用凯迪拉克,2017款 25T 豪华型 周年庆版,凯迪拉克XT5仪表提示故障灯亮希望厂家处理,车身附件及电器电路故障人员技术多次返修,2020-06-21 09:48:54.401,处理反馈
480405,一汽丰田,2020款 2.0L CVT 两驱 风尚PLUS版,一汽丰田RAV4荣放两侧排气管高低不一致,其他疑似设计缺陷,2020-06-21 09:48:54.415,信息审核
480404,广汽本田,2018款 260TURBO 精英版 国V,广汽本田雅阁普利司通轮胎不平导致噪音很大,轮胎磨损,2020-06-21 09:48:54.424,用户评分
480401,北京现代,2016款 1.6L 自动 智炫·精英型,北京现代领动发动机故障灯亮希望处理,发动机故障灯亮,2020-06-21 09:48:54.432,用户评分
480400,广汽丰田,2018款 2.0L 领先天窗版 国VI,广汽丰田C-HR车身变色车漆厚度不一致,车身附件及电器车身有色差,2020-06-21 09:48:54.441,处理反馈
480398,一汽-大众,2018款 1.6L 自动 舒适型,一汽大众速腾玻璃多处划痕希望处理,车身附件及电器玻璃开裂,2020-06-21 09:48:54.449,用户评分
480396,一汽马自达,2020款 2.5L 蓝天运动版,一汽马自达阿特兹车身及内饰多处异响,车身附件及电器车内异响车身附件及电器车身异响,2020-06-21 09:48:54.459,用户评分
480394,一汽马自达,2020款 2.5L 蓝天尊崇版,一汽马自达阿特兹副驾驶B柱行驶时异响,车身附件及电器车身异响,2020-06-21 09:48:54.467,用户评分
480391,上汽大众,2017款 1.6L 手动 舒适版,上汽大众朗逸两前半轴渗油不予维修,前后桥及悬挂系统半轴渗油前后桥及悬挂系统球笼套漏油服务态度不解决问题,2020-06-21 09:48:54.477,用户评分
480390,一汽马自达,2020款 2.5L 蓝天运动版,一汽马自达阿特兹刹车异响中控台异响,制动系统异响车身附件及电器中控台异响,2020-06-21 09:48:54.484,处理反馈
480388,上汽通用雪佛兰,2017款 1.5T 豪华版,雪佛兰迈锐宝停车后仪表台提示未挂入P挡,变速器滑阀箱故障变速器挡把总成故障,2020-06-21 09:48:54.497,用户评分
480385,广汽三菱,2019款 2.0L 两驱 畅享版 5座 国VI,广汽三菱欧蓝德电瓶亏电 车门封条掉色,制动系统ABS故障车身附件及电器电瓶故障车身附件及电器漆面起泡开裂服务态度不解决问题服务流程不完善手续不齐,2020-06-21 09:48:54.506,处理反馈
480383,猎豹汽车,2017款 1.5T CVT 尊贵型,猎豹CS10转向机异响严重希望处理,转向系统异响,2020-06-21 09:48:54.521,信息审核
480382,猎豹汽车,2015款 2.0T  手动 新锐版,猎豹CS10行驶中发动机故障熄火 无法启动,发动机熄火,2020-06-21 09:48:54.528,信息审核
480381,一汽马自达,2020款 2.0L 自动 两驱 蓝天活力版,一汽马自达CX-4车身异响希望尽快处理,车身附件及电器车身异响,2020-06-21 09:48:54.538,用户评分
480380,江淮汽车,2018款 iEVA50 智享型,江淮iEVA50新车手续不符销售欺诈,服务态度不解决问题销售欺诈出售问题车,2020-06-21 09:48:54.546,处理反馈
480378,一汽马自达,2020款 2.0L 自动 两驱 蓝天探索版,一汽马自达CX-4中控异响 仪表盘异响,车身附件及电器中控台异响车身附件及电器车身异响,2020-06-21 09:48:54.555,处理反馈
480375,比亚迪,2019款 1.5T 自动 豪华型,比亚迪宋Pro车道保持及灯光系统与宣传不符,销售欺诈与宣传不符,2020-06-21 09:48:54.565,用户评分
480374,一汽马自达,2020款 2.5L 蓝天运动版,一汽马自达阿特兹车身异响厂家不解决问题,车身附件及电器车内异响服务态度不解决问题,2020-06-21 09:48:54.575,处理反馈
480373,一汽-大众奥迪,2018款 2.0T 时尚型 30周年年型,一汽大众奥迪A4L低速行驶顿挫 油耗增,发动机油耗高变速器顿挫变速器拖挡,2020-06-21 09:48:54.583,信息审核
480371,一汽-大众,2020款 280TSI DSG 两驱 舒适型,一汽大众探歌交完定金后私自加价,服务态度态度蛮横服务收费定（订）金纠纷承诺不兑现销售承诺不兑现,2020-06-21 09:48:54.591,处理反馈
480370,一汽-大众,2017款 1.6L 手动 舒适型,一汽大众速腾后轮传感器故障影响使用,车身附件及电器传感器故障,2020-06-21 09:48:54.601,用户评分
480369,上汽通用别克,2011款 1.6 手动 LE,别克凯越中控台严重开胶 存在安全隐患,车身附件及电器仪表台开裂,2020-06-21 09:48:55.765,处理反馈
480367,吉利汽车,2019款 300T 耀星者,吉利星越中控死机黑屏 版本与宣传不一致,车身附件及电器车载互联故障销售欺诈与宣传不符,2020-06-21 09:48:55.778,用户评分
480364,开沃汽车,南京金龙,南京金龙开沃动力电池出现严重故障,车身附件及电器动力电池故障,2020-06-21 09:48:55.793,信息审核
480359,长安汽车,2019款 蓝鲸版 280T GDI DCT 光速型,长安逸动缺少隔热瓦车门缝隙 无法提速,变速器无法加速车身附件及电器车身不平整其他疑似设计缺陷,2020-06-21 09:48:55.806,用户评分
480355,广汽乘用车,2016款 235T 手动 豪华版,广汽传祺GS4下摆臂减震器和底盘有异响,前后桥及悬挂系统减震器异响前后桥及悬挂系统底盘异响前后桥及悬挂系统下摆臂故障,2020-06-21 09:48:55.815,用户评分
480353,东风标致,2019款 350THP 自动 豪华版 国V,东风标致408行驶中打方向盘时有异响,转向系统异响前后桥及悬挂系统底盘异响,2020-06-21 09:48:55.825,处理反馈
480352,长城汽车,2018款 1.5T 风尚型 蓝标,哈弗H4大灯内部有黑斑要求厂家解决,车身附件及电器车灯不亮,2020-06-21 09:48:55.843,处理反馈
480351,吉利汽车,2020款 350T 驭星者,吉利星越车机系统黑屏操作系统与宣传不符,车身附件及电器车载互联故障销售欺诈与宣传不符,2020-06-21 09:48:55.852,用户评分
480348,一汽-大众,2019款 280TSI DSG 舒适型 国VI,一汽大众速腾制动卡钳松动颠簸路面异响,制动系统异响制动系统刹车泵故障,2020-06-21 09:48:55.862,处理反馈
480347,东风雪铁龙,2018款 1.6L 手动 舒适型,东风雪铁龙C4世嘉发动机故障灯报警,发动机故障灯亮,2020-06-21 09:48:55.873,处理反馈
480346,上汽大众,2019款 330TSI 自动 两驱 全景舒适版 国V,上汽大众途观L变速箱顿挫 换挡不积极,发动机异响发动机怠速不稳变速器顿挫,2020-06-21 09:48:55.886,信息审核
480344,吉利汽车,2018款 1.5L CVT 向上互联版,吉利帝豪踩油门起步时车辆无法行驶,变速器无法加速,2020-06-21 09:48:55.897,用户评分
480343,一汽马自达,2020款 2.5L 蓝天尊崇版,一汽马自达阿特兹车身与车内多处异响,车身附件及电器门窗异响车身附件及电器车内异响车身附件及电器车身异响,2020-06-21 09:48:55.909,处理反馈
480340,长安马自达,2015款 2.0L 自动 两驱 都市型,长安马自达CX-5车窗玻璃和门锁有异响,制动系统手刹故障车身附件及电器门窗异响车身附件及电器中控锁故障,2020-06-21 09:48:55.922,用户评分
480338,吉利汽车,2020款 1.4T CVT 尊贵型,吉利帝豪GL行驶时减震器异响 车身抖动,前后桥及悬挂系统减震器异响车身附件及电器车身共振,2020-06-21 09:48:55.930,处理反馈
480337,东风本田,2016款 220TURBO 自动 尊耀版,东风本田思域机油增多存在严重质量问题,发动机机油增多,2020-06-21 09:48:55.942,处理反馈
480336,长安马自达,2017款 2.5L 自动 两驱 智尊型 国VI,长安马自达CX-5电动折叠后视镜折叠不到位,车身附件及电器后视镜故障,2020-06-21 09:48:55.952,用户评分
480334,长安福特,2020款 EcoBoost 245 两驱 ST-Line 5座,长安福特锐界门板起泡 坐椅起泡,车身附件及电器漆面起泡开裂车身附件及电器座椅故障,2020-06-21 09:48:55.960,处理反馈
480332,东风日产,2020款 2.0L XL 舒适版,东风日产天籁中控异响液压杆异响,发动机油门故障制动系统刹车偏软车身附件及电器中控台异响服务态度厂家不回复,2020-06-21 09:48:55.968,处理反馈
480331,东风本田,2019款 220 TURBO CVT 豪华版 国VI,东风本田XR-V发动机和变速箱连接处漏油,发动机漏油变速器漏油,2020-06-21 09:48:55.978,用户评分
480330,猎豹汽车,2017款 1.5T CVT 尊贵型,猎豹CS10行驶中熄火保养套餐无法使用,发动机熄火承诺不兑现销售承诺不兑现,2020-06-21 09:48:55.988,信息审核
480329,比亚迪,2016款 1.5TI 手动精英型 盖世版,比亚迪宋更换中缸后动力不足要求处理,发动机功率不足服务态度态度蛮横人员技术修出新问题,2020-06-21 09:48:55.998,用户评分
480328,长安汽车,2017款 1.5T 手动 豪享型 国V,长安欧尚A800免费升级N95健康防护不兑现,承诺不兑现服务承诺不兑现,2020-06-21 09:48:56.007,处理反馈
480327,东风日产,2017款 2.0L CVT 智享版 国VI,东风日产逍客变速箱漏油维修后未解决,变速器漏油,2020-06-21 09:48:56.016,处理反馈
480322,上汽集团,2019款 1.5L 自动 4G互联朗越版,上汽荣威i5发动机异响 车身异响,发动机异响车身附件及电器车身异响,2020-06-21 09:48:56.027,用户评分
480321,吉利汽车,2016款 1.3T CVT 向上版 三厢,吉利帝豪前排两侧车门生锈并且腐蚀,车身附件及电器车身生锈,2020-06-21 09:48:56.039,用户评分
480320,猎豹汽车,2017款 1.5T 手动 尊贵型,猎豹CS10转向机有异响厂家一直没有配件,转向系统异响配件争议无零配件,2020-06-21 09:48:56.049,信息审核
480315,一汽马自达,2020款 2.5L 蓝天尊崇版,一汽马自达阿特兹A柱及B柱异响 天窗异响,车身附件及电器车身异响车身附件及电器天窗异响,2020-06-21 09:48:56.058,处理反馈
480313,一汽-大众,2018款 1.6L 自动 舒适型,一汽大众速腾原车真皮座椅表面出现色差,车身附件及电器部件异常磨损,2020-06-21 09:48:56.069,处理反馈
480312,一汽丰田,2019款 1.2T S-CVT GL-i精英版,一汽丰田卡罗拉行驶颠簸路面时中控台异响,车身附件及电器中控台异响,2020-06-21 09:48:56.083,信息审核
480311,东风标致,2015款 1.6THP 自动 致臻版,东风标致508车内一直存在浓重的异味,车身附件及电器车内异味,2020-06-21 09:48:57.062,处理反馈
480308,长安福特,2015款 1.5L 自动 时尚型,长安福特福睿斯主驾驶侧车窗升降失灵,车身附件及电器车窗升降故障,2020-06-21 09:48:57.073,处理反馈
480304,上汽斯柯达,2018款 TSI280 DSG 舒适版 国V,斯柯达速派起步加速时变速箱异响,变速器异响,2020-06-21 09:48:57.087,用户评分
480303,东风悦达起亚,2019款 1.4L 手动 智享版Value 国V,起亚焕驰发动机高温多次维修配件无库存,发动机冷却系统故障服务态度态度蛮横人员技术多次返修人员技术维修技术差配件争议无零配件,2020-06-21 09:48:57.100,处理反馈
480302,北京奔驰,2019款 E 320 L 4MATIC,北京奔驰E级倍耐力轮胎爆胎厂家不索赔,轮胎爆胎服务态度不予索赔,2020-06-21 09:48:57.111,用户评分
480299,北京奔驰,2018款 E 300 L 运动时尚型 改款,北京奔驰E级大灯开裂导致进水希望处理,车身附件及电器部件开裂车身附件及电器车灯进水,2020-06-21 09:48:57.124,处理反馈
480298,一汽-大众,2019款 200TSI 手动 舒适型 国VI,一汽大众速腾右前轮有异响 无上坡辅助系统,前后桥及悬挂系统车轮异响销售欺诈与宣传不符,2020-06-21 09:48:57.139,处理反馈
480294,广汽丰田,2018款 2.0T 四驱 豪华版 7座 国VI,广汽丰田汉兰达踩刹车异响厂家未回复,制动系统异响服务态度厂家不回复人员技术多次返修,2020-06-21 09:48:57.152,处理反馈
480293,广汽乘用车,2018款 235T 自动 两驱 豪华智联百万纪念版,广汽传祺GS4电瓶漏液接线柱腐蚀,车身附件及电器电瓶故障,2020-06-21 09:48:57.163,处理反馈
480292,东风本田,2017款 1.8L EXi CVT 舒适版,东风本田XR-V续保押金和保险返现无人偿还,承诺不兑现销售承诺不兑现服务流程不完善服务网点少,2020-06-21 09:48:57.174,处理反馈
